[
  {
    "name": "嗷呜",
    "path": "嗷呜.mp3",
    "date": "2022-8-22",
    "translate": {
      "zh-CN": "嗷呜",
      "en-US": "nya nya nya"
    },
    "category": "日常"
  },
  {
    "name": "感觉自己是老头",
    "path": "感觉自己是老头.mp3",
    "date": "2022-8-22",
    "translate": {
      "zh-CN": "感觉自己是老头",
      "en-US": "nya nya nya"
    },
    "category": "日常"
  },
  {
    "name": "嘿！芜！",
    "path": "嘿！芜！.mp3",
    "date": "2022-8-22",
    "translate": {
      "zh-CN": "嘿！芜！",
      "en-US": "nya nya nya"
    },
    "category": "日常"
  },
  {
    "name": "你想要我干嘛",
    "path": "你想要我干嘛.mp3",
    "date": "2022-8-22",
    "translate": {
      "zh-CN": "你想要我干嘛",
      "en-US": "nya nya nya"
    },
    "category": "日常"
  },
  {
    "name": "健康的大笑合集",
    "path": "健康的大笑合集.mp3",
    "date": "2022-8-22",
    "translate": {
      "zh-CN": "健康的大笑合集",
      "en-US": "nya nya nya"
    },
    "category": "日常"
  },
  {
    "name": "弱智才要睡觉",
    "path": "弱智才要睡觉.mp3",
    "date": "2022-8-22",
    "translate": {
      "zh-CN": "弱智才要睡觉",
      "en-US": "nya nya nya"
    },
    "category": "日常"
  },
  {
    "name": "我是唱给你们听的",
    "path": "我是唱给你们听的.mp3",
    "date": "2022-8-22",
    "translate": {
      "zh-CN": "我是唱给你们听的",
      "en-US": "nya nya nya"
    },
    "category": "日常"
  },
  {
    "name": "你们根本不知道我在唱什么吧",
    "path": "你们根本不知道我在唱什么吧.mp3",
    "date": "2022-8-22",
    "translate": {
      "zh-CN": "你们根本不知道我在唱什么吧",
      "en-US": "nya nya nya"
    },
    "category": "日常"
  },
  {
    "name": "我没急",
    "path": "我没急.mp3",
    "date": "2022-8-22",
    "translate": {
      "zh-CN": "我没急",
      "en-US": "nya nya nya"
    },
    "category": "日常"
  },
  {
    "name": "我是鱼",
    "path": "我是鱼.mp3",
    "date": "2022-8-22",
    "translate": {
      "zh-CN": "我是鱼",
      "en-US": "nya nya nya"
    },
    "category": "日常"
  },
  {
    "name": "你们怎么不自己切了",
    "path": "你们怎么不自己切了.mp3",
    "date": "2022-8-22",
    "translate": {
      "zh-CN": "你们怎么不自己切了",
      "en-US": "nya nya nya"
    },
    "category": "日常"
  },
  {
    "name": "不要切这个！",
    "path": "不要切这个！.mp3",
    "date": "2022-8-22",
    "translate": {
      "zh-CN": "不要切这个！",
      "en-US": "nya nya nya"
    },
    "category": "日常"
  },
  {
    "name": "还在切？不准切",
    "path": "还在切？不准切.mp3",
    "date": "2022-8-22",
    "translate": {
      "zh-CN": "还在切？不准切",
      "en-US": "nya nya nya"
    },
    "category": "日常"
  },
  {
    "name": "cute but dont cut",
    "path": "cute but dont cut.mp3",
    "date": "2022-8-22",
    "translate": {
      "zh-CN": "cute but dont cut",
      "en-US": "nya nya nya"
    },
    "category": "日常"
  },
  {
    "name": "哼",
    "path": "哼.mp3",
    "date": "2022-8-22",
    "translate": {
      "zh-CN": "哼",
      "en-US": "nya nya nya"
    },
    "category": "日常"
  }
]