[
  {
    "name": "哼③",
    "path": "哼③.mp3",
    "date": "2022-9.21",
    "translate": {
      "zh-CN": "哼③",
      "en-US": "nya nya nya"
    },
    "category": "日常"
  },
  {
    "name": "唱错了重来一遍",
    "path": "唱错了重来一遍.mp3",
    "date": "2022-9.21",
    "translate": {
      "zh-CN": "唱错了重来一遍",
      "en-US": "nya nya nya"
    },
    "category": "日常"
  },
  {
    "name": "不明动物的叫声",
    "path": "不明动物的叫声.mp3",
    "date": "2022-9.21",
    "translate": {
      "zh-CN": "不明动物的叫声",
      "en-US": "nya nya nya"
    },
    "category": "日常"
  },
  {
    "name": "酒鬼的透支与偿还",
    "path": "酒鬼的透支与偿还.mp3",
    "date": "2022-9.21",
    "translate": {
      "zh-CN": "酒鬼的透支与偿还",
      "en-US": "nya nya nya"
    },
    "category": "梗"
  },
  {
    "name": "会都说不话了",
    "path": "会都说不话了.mp3",
    "date": "2022-9.21",
    "translate": {
      "zh-CN": "会都说不话了",
      "en-US": "nya nya nya"
    },
    "category": "日常"
  },
  {
    "name": "嗯？嗯？",
    "path": "嗯？嗯？.mp3",
    "date": "2022-9.21",
    "translate": {
      "zh-CN": "嗯？嗯？",
      "en-US": "nya nya nya"
    },
    "category": "日常"
  },
  {
    "name": "开趴啰",
    "path": "开趴啰.mp3",
    "date": "2022-9.21",
    "translate": {
      "zh-CN": "开趴啰",
      "en-US": "nya nya nya"
    },
    "category": "日常"
  },
  {
    "name": "瑞娅前辈速速给我一个mua",
    "path": "瑞娅前辈速速给我一个mua.mp3",
    "date": "2022-9.21",
    "translate": {
      "zh-CN": "瑞娅前辈速速给我一个mua",
      "en-US": "nya nya nya"
    },
    "category": "梗"
  },
  {
    "name": "我活啦我复活辣",
    "path": "我活啦我复活辣.mp3",
    "date": "2022-9.21",
    "translate": {
      "zh-CN": "我活啦我复活辣",
      "en-US": "nya nya nya"
    },
    "category": "日常"
  },
  {
    "name": "我们算了吧",
    "path": "我们算了吧.mp3",
    "date": "2022-9.21",
    "translate": {
      "zh-CN": "我们算了吧",
      "en-US": "nya nya nya"
    },
    "category": "日常"
  },
  {
    "name": "又唱错了",
    "path": "又唱错了.mp3",
    "date": "2022-9.21",
    "translate": {
      "zh-CN": "又唱错了",
      "en-US": "nya nya nya"
    },
    "category": "梗"
  },
  {
    "name": "我想要真物",
    "path": "我想要真物.mp3",
    "date": "2022-9.21",
    "translate": {
      "zh-CN": "我想要真物",
      "en-US": "nya nya nya"
    },
    "category": "日常"
  },
  {
    "name": "网站都可以投(免责声明)",
    "path": "网站都可以投(免责声明).mp3",
    "date": "2022-9.21",
    "translate": {
      "zh-CN": "网站都可以投(免责声明)",
      "en-US": "nya nya nya"
    },
    "category": "日常"
  }
]