[
  {
    "name": "谢谢你关注我mua",
    "path": "谢谢你关注我mua.mp3",
    "date": "2022-8-31",
    "translate": {
      "zh-CN": "谢谢你关注我mua",
      "en-US": "nya nya nya"
    },
    "category": "日常"
  },
  {
    "name": "箔啊",
    "path": "箔啊.mp3",
    "date": "2022-8-31",
    "translate": {
      "zh-CN": "箔啊",
      "en-US": "nya nya nya"
    },
    "category": "日常"
  },
  {
    "name": "要吃什么呢",
    "path": "要吃什么呢.mp3",
    "date": "2022-8-31",
    "translate": {
      "zh-CN": "要吃什么呢",
      "en-US": "nya nya nya"
    },
    "category": "日常"
  },
  {
    "name": "大家一起吃",
    "path": "大家一起吃.mp3",
    "date": "2022-8-31",
    "translate": {
      "zh-CN": "大家一起吃",
      "en-US": "nya nya nya"
    },
    "category": "日常"
  },
  {
    "name": "111真穿吗",
    "path": "111真穿吗.mp3",
    "date": "2022-8-31",
    "translate": {
      "zh-CN": "111真穿吗",
      "en-US": "nya nya nya"
    },
    "category": "日常"
  },
  {
    "name": "啊！水差点泼出来了",
    "path": "啊！水差点泼出来了.mp3",
    "date": "2022-8-31",
    "translate": {
      "zh-CN": "啊！水差点泼出来了",
      "en-US": "nya nya nya"
    },
    "category": "日常"
  },
  {
    "name": "哼②",
    "path": "哼②.mp3",
    "date": "2022-8-31",
    "translate": {
      "zh-CN": "哼②",
      "en-US": "nya nya nya"
    },
    "category": "日常"
  },
  {
    "name": "我在看着你",
    "path": "我在看着你.mp3",
    "date": "2022-8-31",
    "translate": {
      "zh-CN": "我在看着你",
      "en-US": "nya nya nya"
    },
    "category": "日常"
  },
  {
    "name": "我一直都在看着你",
    "path": "我一直都在看着你.mp3",
    "date": "2022-8-31",
    "translate": {
      "zh-CN": "我一直都在看着你",
      "en-US": "nya nya nya"
    },
    "category": "日常"
  }
]