[
  {
    "name": "啊啊啊啊",
    "path": "啊啊啊啊.mp3",
    "date": "2023-2.4",
    "translate": {
      "zh-CN": "啊啊啊啊",
      "en-US": "nya nya nya"
    },
    "category": "日常"
  },
  {
    "name": "我tm小孩子证呢",
    "path": "我tm小孩子证呢.mp3",
    "date": "2023-2.4",
    "translate": {
      "zh-CN": "我tm小孩子证呢",
      "en-US": "nya nya nya"
    },
    "category": "日常"
  },
  {
    "name": "不行已经要睡着了",
    "path": "不行已经要睡着了.mp3",
    "date": "2023-2.4",
    "translate": {
      "zh-CN": "不行已经要睡着了",
      "en-US": "nya nya nya"
    },
    "category": "日常"
  },
  {
    "name": "好困呀",
    "path": "好困呀.mp3",
    "date": "2023-2.4",
    "translate": {
      "zh-CN": "好困呀",
      "en-US": "nya nya nya"
    },
    "category": "日常"
  },
  {
    "name": "贝壳",
    "path": "贝壳.mp3",
    "date": "2023-2.4",
    "translate": {
      "zh-CN": "贝壳",
      "en-US": "nya nya nya"
    },
    "category": "日常"
  },
  {
    "name": "棉花糖",
    "path": "棉花糖.mp3",
    "date": "2023-2.4",
    "translate": {
      "zh-CN": "棉花糖",
      "en-US": "nya nya nya"
    },
    "category": "日常"
  },
  {
    "name": "我的时间好像不多了",
    "path": "我的时间好像不多了.mp3",
    "date": "2023-2.4",
    "translate": {
      "zh-CN": "我的时间好像不多了",
      "en-US": "nya nya nya"
    },
    "category": "日常"
  },
  {
    "name": "晚安29秒",
    "path": "晚安29秒.mp3",
    "date": "2023-2.4",
    "translate": {
      "zh-CN": "晚安29秒",
      "en-US": "nya nya nya"
    },
    "category": "梗"
  },
  {
    "name": "老东西早该414了",
    "path": "老东西早该414了.mp3",
    "date": "2023-2.4",
    "translate": {
      "zh-CN": "老东西早该414了",
      "en-US": "nya nya nya"
    },
    "category": "日常"
  },
  {
    "name": "再见了猫奶奶",
    "path": "再见了猫奶奶.mp3",
    "date": "2023-2.4",
    "translate": {
      "zh-CN": "再见了猫奶奶",
      "en-US": "nya nya nya"
    },
    "category": "日常"
  },
  {
    "name": "复活吧小雪",
    "path": "复活吧小雪.mp3",
    "date": "2023-2.4",
    "translate": {
      "zh-CN": "复活吧小雪",
      "en-US": "nya nya nya"
    },
    "category": "日常"
  },
  {
    "name": "复活吧！",
    "path": "复活吧！.mp3",
    "date": "2023-2.4",
    "translate": {
      "zh-CN": "复活吧！",
      "en-US": "nya nya nya"
    },
    "category": "日常"
  },
  {
    "name": "换首吧",
    "path": "换首吧.mp3",
    "date": "2023-2.4",
    "translate": {
      "zh-CN": "换首吧",
      "en-US": "nya nya nya"
    },
    "category": "日常"
  }
]