[
  {
    "name": "别在这理发店",
    "path": "别在这理发店.mp3",
    "date": "2022-8-29",
    "translate": {
      "zh-CN": "别在这理发店",
      "en-US": "nya nya nya"
    },
    "category": "日常"
  },
  {
    "name": "吃完小龙虾以后的饱嗝",
    "path": "吃完小龙虾以后的饱嗝.mp3",
    "date": "2022-8-29",
    "translate": {
      "zh-CN": "吃完小龙虾以后的饱嗝",
      "en-US": "nya nya nya"
    },
    "category": "日常"
  },
  {
    "name": "我做我做我做你XX",
    "path": "我做我做我做你XX.mp3",
    "date": "2022-8-29",
    "translate": {
      "zh-CN": "我做我做我做你XX",
      "en-US": "nya nya nya"
    },
    "category": "日常"
  },
  {
    "name": "登山式B动静",
    "path": "登山式B动静.mp3",
    "date": "2022-8-29",
    "translate": {
      "zh-CN": "登山式B动静",
      "en-US": "nya nya nya"
    },
    "category": "日常"
  },
  {
    "name": "要开榨啦",
    "path": "要开榨啦.mp3",
    "date": "2022-8-29",
    "translate": {
      "zh-CN": "要开榨啦",
      "en-US": "nya nya nya"
    },
    "category": "日常"
  },
  {
    "name": "肚子叫了",
    "path": "肚子叫了.mp3",
    "date": "2022-8-29",
    "translate": {
      "zh-CN": "肚子叫了",
      "en-US": "nya nya nya"
    },
    "category": "日常"
  },
  {
    "name": "阿梓谁呀",
    "path": "阿梓谁呀.mp3",
    "date": "2022-8-29",
    "translate": {
      "zh-CN": "阿梓谁呀",
      "en-US": "nya nya nya"
    },
    "category": "日常"
  },
  {
    "name": "嘴里含着点什么的声音",
    "path": "嘴里含着点什么的声音.mp3",
    "date": "2022-8-29",
    "translate": {
      "zh-CN": "嘴里含着点什么的声音",
      "en-US": "nya nya nya"
    },
    "category": "日常"
  },
  {
    "name": "《夏の花は向日葵だけじゃない》",
    "path": "《夏の花は向日葵だけじゃない》.mp3",
    "date": "2022-8-29",
    "translate": {
      "zh-CN": "《夏の花は向日葵だけじゃない》",
      "en-US": "nya nya nya"
    },
    "category": "歌"
  }
]