[
  {
    "name": "《8_32》",
    "path": "《8_32》.mp3",
    "date": "2022-9.5",
    "translate": {
      "zh-CN": "《8.32》",
      "en-US": "nya nya nya"
    },
    "category": "歌"
  },
  {
    "name": "《10 YEARS AFTER》",
    "path": "《10 YEARS AFTER》.mp3",
    "date": "2022-9.5",
    "translate": {
      "zh-CN": "《10 YEARS AFTER》",
      "en-US": "nya nya nya"
    },
    "category": "歌"
  },
  {
    "name": "《First Love》",
    "path": "《First Love》.mp3",
    "date": "2022-9.5",
    "translate": {
      "zh-CN": "《First Love》",
      "en-US": "nya nya nya"
    },
    "category": "歌"
  },
  {
    "name": "《GIRAFFE BLUES》",
    "path": "《GIRAFFE BLUES》.mp3",
    "date": "2022-9.5",
    "translate": {
      "zh-CN": "《GIRAFFE BLUES》",
      "en-US": "nya nya nya"
    },
    "category": "歌"
  },
  {
    "name": "《One more time，One more chance》",
    "path": "《One more time，One more chance》.mp3",
    "date": "2022-9.5",
    "translate": {
      "zh-CN": "《One more time，One more chance》",
      "en-US": "nya nya nya"
    },
    "category": "歌"
  },
  {
    "name": "《SPiCa》",
    "path": "《SPiCa》.mp3",
    "date": "2022-9.5",
    "translate": {
      "zh-CN": "《SPiCa》",
      "en-US": "nya nya nya"
    },
    "category": "歌"
  },
  {
    "name": "《STONES》",
    "path": "《STONES》.mp3",
    "date": "2022-9.5",
    "translate": {
      "zh-CN": "《STONES》",
      "en-US": "nya nya nya"
    },
    "category": "歌"
  },
  {
    "name": "《Virtual to LIVE》",
    "path": "《Virtual to LIVE》.mp3",
    "date": "2022-9.5",
    "translate": {
      "zh-CN": "《Virtual to LIVE》",
      "en-US": "nya nya nya"
    },
    "category": "歌"
  },
  {
    "name": "《カムパネルラ》（康培内拉）",
    "path": "《カムパネルラ》（康培内拉）.mp3",
    "date": "2022-9.5",
    "translate": {
      "zh-CN": "《カムパネルラ》（康培内拉）",
      "en-US": "nya nya nya"
    },
    "category": "歌"
  },
  {
    "name": "《スパークル》（火花）",
    "path": "《スパークル》（火花）.mp3",
    "date": "2022-9.5",
    "translate": {
      "zh-CN": "《スパークル》（火花）",
      "en-US": "nya nya nya"
    },
    "category": "歌"
  },
  {
    "name": "《ダークサイドについてきて》（跟我走进心的背面）",
    "path": "《ダークサイドについてきて》（跟我走进心的背面）.mp3",
    "date": "2022-9.5",
    "translate": {
      "zh-CN": "《ダークサイドについてきて》（跟我走进心的背面）",
      "en-US": "nya nya nya"
    },
    "category": "歌"
  },
  {
    "name": "《タイムマシン》（时光机）",
    "path": "《タイムマシン》（时光机）.mp3",
    "date": "2022-9.5",
    "translate": {
      "zh-CN": "《タイムマシン》（时光机）",
      "en-US": "nya nya nya"
    },
    "category": "歌"
  },
  {
    "name": "《ぼくのフレンド》（我的朋友）",
    "path": "《ぼくのフレンド》（我的朋友）.mp3",
    "date": "2022-9.5",
    "translate": {
      "zh-CN": "《ぼくのフレンド》（我的朋友）",
      "en-US": "nya nya nya"
    },
    "category": "歌"
  },
  {
    "name": "《メランコリック》（忧郁症患者）",
    "path": "《メランコリック》（忧郁症患者）.mp3",
    "date": "2022-9.5",
    "translate": {
      "zh-CN": "《メランコリック》（忧郁症患者）",
      "en-US": "nya nya nya"
    },
    "category": "歌"
  },
  {
    "name": "《もどかしい世界の上で》（在急不可待的世界上）",
    "path": "《もどかしい世界の上で》（在急不可待的世界上）.mp3",
    "date": "2022-9.5",
    "translate": {
      "zh-CN": "《もどかしい世界の上で》（在急不可待的世界上）",
      "en-US": "nya nya nya"
    },
    "category": "歌"
  },
  {
    "name": "《割れたリンゴ》（破碎的苹果）",
    "path": "《割れたリンゴ》（破碎的苹果）.mp3",
    "date": "2022-9.5",
    "translate": {
      "zh-CN": "《割れたリンゴ》（破碎的苹果）",
      "en-US": "nya nya nya"
    },
    "category": "歌"
  },
  {
    "name": "《君の知らない物語》（你不知道的故事）",
    "path": "《君の知らない物語》（你不知道的故事）.mp3",
    "date": "2022-9.5",
    "translate": {
      "zh-CN": "《君の知らない物語》（你不知道的故事）",
      "en-US": "nya nya nya"
    },
    "category": "歌"
  },
  {
    "name": "《瑠璃色の地球》",
    "path": "《瑠璃色の地球》.mp3",
    "date": "2022-9.5",
    "translate": {
      "zh-CN": "《瑠璃色の地球》",
      "en-US": "nya nya nya"
    },
    "category": "歌"
  },
  {
    "name": "《五線譜の空》",
    "path": "《五線譜の空》.mp3",
    "date": "2022-9.5",
    "translate": {
      "zh-CN": "《五線譜の空》",
      "en-US": "nya nya nya"
    },
    "category": "歌"
  },
  {
    "name": "《音偽ハナシ》（伪音物语）",
    "path": "《音偽ハナシ》（伪音物语）.mp3",
    "date": "2022-9.5",
    "translate": {
      "zh-CN": "《音偽ハナシ》（伪音物语）",
      "en-US": "nya nya nya"
    },
    "category": "歌"
  },
  {
    "name": "《優しさの理由》（温柔的理由）",
    "path": "《優しさの理由》（温柔的理由）.mp3",
    "date": "2022-9.5",
    "translate": {
      "zh-CN": "《優しさの理由》（温柔的理由）",
      "en-US": "nya nya nya"
    },
    "category": "歌"
  },
  {
    "name": "《真夏の果実》",
    "path": "《真夏の果実》.mp3",
    "date": "2022-9.5",
    "translate": {
      "zh-CN": "《真夏の果実》",
      "en-US": "nya nya nya"
    },
    "category": "歌"
  },
  {
    "name": "《自傷無色》",
    "path": "《自傷無色》.mp3",
    "date": "2022-9.5",
    "translate": {
      "zh-CN": "《自傷無色》",
      "en-US": "nya nya nya"
    },
    "category": "歌"
  },
  {
    "name": "烦死啦",
    "path": "烦死啦.mp3",
    "date": "2022-9.5",
    "translate": {
      "zh-CN": "烦死啦",
      "en-US": "nya nya nya"
    },
    "category": "日常"
  }
]